{
  "$schema": "https://json-schema.org/draft/2020-12/schema",
  "$id": "https://english-town.local/schemas/scene-plan.schema.json",
  "title": "ScenePlan",
  "type": "object",
  "required": ["schemaVersion", "sceneId", "generationId", "revision", "mode", "archetypeId", "setting", "fills", "characters"],
  "properties": {
    "schemaVersion": { "const": "1.0" },
    "sceneId": { "type": "string" },
    "generationId": { "type": "string" },
    "revision": { "type": "integer", "minimum": 1 },
    "mode": { "enum": ["free", "quest"] },
    "archetypeId": { "type": "string" },
    "setting": {
      "type": "object", "required": ["displayName", "time"],
      "properties": { "displayName": { "type": "string" }, "time": { "type": "string" } }
    },
    "fills": {
      "type": "array",
      "items": { "type": "object", "required": ["slotId", "entity"], "properties": { "slotId": { "type": "string" }, "entity": { "$ref": "https://english-town.local/schemas/entity.schema.json" } } }
    },
    "characters": {
      "type": "array",
      "items": { "type": "object", "required": ["slotId", "npcId"], "properties": { "slotId": { "type": "string" }, "npcId": { "type": "string" } } }
    },
    "objectives": { "type": "array", "default": [] },
    "exits": { "type": "array", "default": [] }
  }
}
